{
  "acceptance_specs": [
    {
      "id": "SPEC-12-001",
      "negative_cases": [
        {
          "action": "调用目标函数",
          "case_id": "NEG-12-001",
          "expected_rejection": "失败关闭且不产生部分副作用",
          "setup": "loader 异常、畸形返回、零/布尔 TTL 不得改变 cache"
        }
      ],
      "positive_cases": [
        {
          "action": "调用目标函数",
          "case_id": "POS-12-001",
          "expected": "得到合同指定结果",
          "setup": "新鲜值不调用 loader"
        },
        {
          "action": "调用目标函数",
          "case_id": "POS-12-002",
          "expected": "得到合同指定结果",
          "setup": "边界过期值重新加载并写入 now+ttl"
        }
      ],
      "semantic_boundaries": [
        {
          "boundary_id": "BOUND-12-001",
          "dimension": "任务语义边界",
          "inside": "新鲜值不调用 loader",
          "outside": "loader 异常、畸形返回、零/布尔 TTL 不得改变 cache",
          "rule": "expires_at 等于 now 已过期；TTL 必须是非布尔正整数，写入是最后一步。"
        }
      ],
      "statement": "实现 read_through_cache：expires_at>now 才命中，过期时调用 loader，并仅在 loader 成功且 TTL 合法后提交缓存。",
      "validator": {
        "command": "python3 -m unittest tests.test_tasks.ReadThroughCacheTests -v",
        "kind": "command",
        "timeout_seconds": 30
      }
    }
  ],
  "allowed_paths": [
    "src/tasks.py"
  ],
  "assignment": {
    "network": "deny-by-default",
    "preferred_model": "benchmark-assigned",
    "workspace_mode": "isolated-worktree"
  },
  "content_sha256": "25204825ce72b31b924ac4045e252039e5ecc220c399a28695799267d5982210",
  "context_refs": [],
  "created_at": "2026-07-12T15:00:00+08:00",
  "created_by": {
    "model": "gpt-5.6-sol",
    "role": "decomposition-lead",
    "runtime": "codex",
    "session_id": "suite-design-frozen"
  },
  "dependencies": [],
  "forbidden_paths": [
    "tests/**",
    "src/__init__.py"
  ],
  "invariants": [
    "INV-001"
  ],
  "limits": {
    "max_changed_files": 1,
    "max_diff_lines": 180,
    "max_rework_rounds": 1,
    "wall_clock_minutes": 25
  },
  "mission_id": "msn_eval_12_001",
  "object_id": "wo_T_EVAL_12_r1",
  "objective": "实现 read_through_cache：expires_at>now 才命中，过期时调用 loader，并仅在 loader 成功且 TTL 合法后提交缓存。",
  "parent_task_id": null,
  "rationale": "补齐 medium 风险 integration 分层，扩展配对质量—Token 证据。",
  "required_deliverables": [
    "git_commit",
    "patch",
    "test_results"
  ],
  "revision": 1,
  "risk": {
    "level": "medium",
    "reasons": [
      "expires_at 等于 now 已过期；TTL 必须是非布尔正整数，写入是最后一步。"
    ],
    "required_review": "terra-then-sol"
  },
  "schema": "token-firewall/work-order@0.2",
  "stop_conditions": [
    "需要修改公开测试或其他源文件",
    "需要增加第三方依赖",
    "Diff 超过 180 行"
  ],
  "task_id": "T-EVAL-12"
}
