{
  "acceptance_specs": [
    {
      "id": "SPEC-03-001",
      "negative_cases": [
        {
          "action": "调用目标函数",
          "case_id": "NEG-03-001",
          "expected_rejection": "失败关闭且不产生部分副作用",
          "setup": "'02s'、全角数字、零值与超过 max_milliseconds 的值抛出 ValueError"
        }
      ],
      "positive_cases": [
        {
          "action": "调用目标函数",
          "case_id": "POS-03-001",
          "expected": "得到合同指定结果",
          "setup": "parse_duration('250ms') 返回 250"
        },
        {
          "action": "调用目标函数",
          "case_id": "POS-03-002",
          "expected": "得到合同指定结果",
          "setup": "parse_duration('3m') 返回 180000"
        }
      ],
      "semantic_boundaries": [
        {
          "boundary_id": "BOUND-03-001",
          "dimension": "任务语义边界",
          "inside": "parse_duration('250ms') 返回 250",
          "outside": "'02s'、全角数字、零值与超过 max_milliseconds 的值抛出 ValueError",
          "rule": "原始值必须匹配 [1-9][0-9]*(ms|s|m|h)，换算值不得超过显式上限。"
        }
      ],
      "statement": "实现 parse_duration，解析 ms/s/m/h ASCII 语法并对非法、零值、前导零和越界输入失败关闭。",
      "validator": {
        "command": "python3 -m unittest tests.test_tasks.ParseDurationTests -v",
        "kind": "command",
        "timeout_seconds": 30
      }
    }
  ],
  "allowed_paths": [
    "src/tasks.py"
  ],
  "assignment": {
    "network": "deny-by-default",
    "preferred_model": "benchmark-assigned",
    "workspace_mode": "isolated-worktree"
  },
  "content_sha256": "7900bbcb8e52074124428ad015e03a0fe1bccdbd660f5291559d49be459959ec",
  "context_refs": [],
  "created_at": "2026-07-12T15:00:00+08:00",
  "created_by": {
    "model": "gpt-5.6-sol",
    "role": "decomposition-lead",
    "runtime": "codex",
    "session_id": "suite-design-frozen"
  },
  "dependencies": [],
  "forbidden_paths": [
    "tests/**",
    "src/__init__.py"
  ],
  "invariants": [
    "INV-001"
  ],
  "limits": {
    "max_changed_files": 1,
    "max_diff_lines": 180,
    "max_rework_rounds": 1,
    "wall_clock_minutes": 25
  },
  "mission_id": "msn_eval_03_001",
  "object_id": "wo_T_EVAL_03_r1",
  "objective": "实现 parse_duration，解析 ms/s/m/h ASCII 语法并对非法、零值、前导零和越界输入失败关闭。",
  "parent_task_id": null,
  "rationale": "补齐 low 风险 feature 分层，扩展配对质量—Token 证据。",
  "required_deliverables": [
    "git_commit",
    "patch",
    "test_results"
  ],
  "revision": 1,
  "risk": {
    "level": "low",
    "reasons": [
      "原始值必须匹配 [1-9][0-9]*(ms|s|m|h)，换算值不得超过显式上限。"
    ],
    "required_review": "terra-then-sol"
  },
  "schema": "token-firewall/work-order@0.2",
  "stop_conditions": [
    "需要修改公开测试或其他源文件",
    "需要增加第三方依赖",
    "Diff 超过 180 行"
  ],
  "task_id": "T-EVAL-03"
}
