{
  "acceptance_specs": [
    {
      "id": "SPEC-05-001",
      "negative_cases": [
        {
          "action": "调用目标函数",
          "case_id": "NEG-05-001",
          "expected_rejection": "失败关闭且不产生部分副作用",
          "setup": "None 等不可迭代输入抛出 TypeError"
        }
      ],
      "positive_cases": [
        {
          "action": "调用目标函数",
          "case_id": "POS-05-001",
          "expected": "得到合同指定结果",
          "setup": "['b','a','b'] 返回 ['b','a']"
        },
        {
          "action": "调用目标函数",
          "case_id": "POS-05-002",
          "expected": "得到合同指定结果",
          "setup": "[[1],[1],[2]] 返回 [[1],[2]]"
        }
      ],
      "semantic_boundaries": [
        {
          "boundary_id": "BOUND-05-001",
          "dimension": "任务语义边界",
          "inside": "['b','a','b'] 返回 ['b','a']",
          "outside": "None 等不可迭代输入抛出 TypeError",
          "rule": "重复判定使用 Python 相等性；输出不得重排且不得要求元素可哈希。"
        }
      ],
      "statement": "重构 stable_unique，按相等性保留第一次出现顺序并支持生成器和不可哈希值。",
      "validator": {
        "command": "python3 -m unittest tests.test_tasks.StableUniqueTests -v",
        "kind": "command",
        "timeout_seconds": 30
      }
    }
  ],
  "allowed_paths": [
    "src/tasks.py"
  ],
  "assignment": {
    "network": "deny-by-default",
    "preferred_model": "benchmark-assigned",
    "workspace_mode": "isolated-worktree"
  },
  "content_sha256": "c53d258d61a506908aee131e5795e85324e5b2c70f25da99a7a1521c6daeff6d",
  "context_refs": [],
  "created_at": "2026-07-12T15:00:00+08:00",
  "created_by": {
    "model": "gpt-5.6-sol",
    "role": "decomposition-lead",
    "runtime": "codex",
    "session_id": "suite-design-frozen"
  },
  "dependencies": [],
  "forbidden_paths": [
    "tests/**",
    "src/__init__.py"
  ],
  "invariants": [
    "INV-001"
  ],
  "limits": {
    "max_changed_files": 1,
    "max_diff_lines": 180,
    "max_rework_rounds": 1,
    "wall_clock_minutes": 25
  },
  "mission_id": "msn_eval_05_001",
  "object_id": "wo_T_EVAL_05_r1",
  "objective": "重构 stable_unique，按相等性保留第一次出现顺序并支持生成器和不可哈希值。",
  "parent_task_id": null,
  "rationale": "补齐 low 风险 refactor 分层，扩展配对质量—Token 证据。",
  "required_deliverables": [
    "git_commit",
    "patch",
    "test_results"
  ],
  "revision": 1,
  "risk": {
    "level": "low",
    "reasons": [
      "重复判定使用 Python 相等性；输出不得重排且不得要求元素可哈希。"
    ],
    "required_review": "terra-then-sol"
  },
  "schema": "token-firewall/work-order@0.2",
  "stop_conditions": [
    "需要修改公开测试或其他源文件",
    "需要增加第三方依赖",
    "Diff 超过 180 行"
  ],
  "task_id": "T-EVAL-05"
}
