{
  "acceptance_specs": [
    {
      "id": "SPEC-04-001",
      "negative_cases": [
        {
          "action": "调用目标函数",
          "case_id": "NEG-04-001",
          "expected_rejection": "失败关闭且不产生部分副作用",
          "setup": "非字符串 key/value、畸形 pair 或 None 抛出 TypeError/ValueError"
        }
      ],
      "positive_cases": [
        {
          "action": "调用目标函数",
          "case_id": "POS-04-001",
          "expected": "得到合同指定结果",
          "setup": "空格编码为 %20、斜线编码为 %2F、~ 保留"
        },
        {
          "action": "调用目标函数",
          "case_id": "POS-04-002",
          "expected": "得到合同指定结果",
          "setup": "重复 key 全部保留并按编码值排序"
        }
      ],
      "semantic_boundaries": [
        {
          "boundary_id": "BOUND-04-001",
          "dimension": "任务语义边界",
          "inside": "空格编码为 %20、斜线编码为 %2F、~ 保留",
          "outside": "非字符串 key/value、畸形 pair 或 None 抛出 TypeError/ValueError",
          "rule": "排序发生在 RFC3986 编码之后；不得使用 application/x-www-form-urlencoded 的 + 空格语义。"
        }
      ],
      "statement": "实现 canonical_query：严格字符串二元组、UTF-8 百分号编码、按编码后 key/value 排序并保留重复项。",
      "validator": {
        "command": "python3 -m unittest tests.test_tasks.CanonicalQueryTests -v",
        "kind": "command",
        "timeout_seconds": 30
      }
    }
  ],
  "allowed_paths": [
    "src/tasks.py"
  ],
  "assignment": {
    "network": "deny-by-default",
    "preferred_model": "benchmark-assigned",
    "workspace_mode": "isolated-worktree"
  },
  "content_sha256": "b5c15beecb3d12ebb5f017c97b7d7c094a301d5887f292513633809b3d0203c8",
  "context_refs": [],
  "created_at": "2026-07-12T15:00:00+08:00",
  "created_by": {
    "model": "gpt-5.6-sol",
    "role": "decomposition-lead",
    "runtime": "codex",
    "session_id": "suite-design-frozen"
  },
  "dependencies": [],
  "forbidden_paths": [
    "tests/**",
    "src/__init__.py"
  ],
  "invariants": [
    "INV-001"
  ],
  "limits": {
    "max_changed_files": 1,
    "max_diff_lines": 180,
    "max_rework_rounds": 1,
    "wall_clock_minutes": 25
  },
  "mission_id": "msn_eval_04_001",
  "object_id": "wo_T_EVAL_04_r1",
  "objective": "实现 canonical_query：严格字符串二元组、UTF-8 百分号编码、按编码后 key/value 排序并保留重复项。",
  "parent_task_id": null,
  "rationale": "补齐 medium 风险 feature 分层，扩展配对质量—Token 证据。",
  "required_deliverables": [
    "git_commit",
    "patch",
    "test_results"
  ],
  "revision": 1,
  "risk": {
    "level": "medium",
    "reasons": [
      "排序发生在 RFC3986 编码之后；不得使用 application/x-www-form-urlencoded 的 + 空格语义。"
    ],
    "required_review": "terra-then-sol"
  },
  "schema": "token-firewall/work-order@0.2",
  "stop_conditions": [
    "需要修改公开测试或其他源文件",
    "需要增加第三方依赖",
    "Diff 超过 180 行"
  ],
  "task_id": "T-EVAL-04"
}
