{
  "acceptance_specs": [
    {
      "id": "SPEC-07-001",
      "negative_cases": [
        {
          "action": "调用目标函数",
          "case_id": "NEG-07-001",
          "expected_rejection": "失败关闭且不产生部分副作用",
          "setup": "重复游标、非列表 items、空游标或超过 max_pages 抛出错误"
        }
      ],
      "positive_cases": [
        {
          "action": "调用目标函数",
          "case_id": "POS-07-001",
          "expected": "得到合同指定结果",
          "setup": "依次请求 None、a、b 并按页序返回所有 items"
        }
      ],
      "semantic_boundaries": [
        {
          "boundary_id": "BOUND-07-001",
          "dimension": "任务语义边界",
          "inside": "依次请求 None、a、b 并按页序返回所有 items",
          "outside": "重复游标、非列表 items、空游标或超过 max_pages 抛出错误",
          "rule": "只有 None 表示终止；继续游标必须是非空字符串且每次唯一。"
        }
      ],
      "statement": "实现 collect_pages：从 None 游标开始，按序聚合 items，在 next_cursor=None 结束，并拒绝循环、畸形响应和页数越界。",
      "validator": {
        "command": "python3 -m unittest tests.test_tasks.CollectPagesTests -v",
        "kind": "command",
        "timeout_seconds": 30
      }
    }
  ],
  "allowed_paths": [
    "src/tasks.py"
  ],
  "assignment": {
    "network": "deny-by-default",
    "preferred_model": "benchmark-assigned",
    "workspace_mode": "isolated-worktree"
  },
  "content_sha256": "6cd5509c90bea8ebf821659a87c276e0cc67d7287d46baf59f77fb7eb632a941",
  "context_refs": [],
  "created_at": "2026-07-12T15:00:00+08:00",
  "created_by": {
    "model": "gpt-5.6-sol",
    "role": "decomposition-lead",
    "runtime": "codex",
    "session_id": "suite-design-frozen"
  },
  "dependencies": [],
  "forbidden_paths": [
    "tests/**",
    "src/__init__.py"
  ],
  "invariants": [
    "INV-001"
  ],
  "limits": {
    "max_changed_files": 1,
    "max_diff_lines": 180,
    "max_rework_rounds": 1,
    "wall_clock_minutes": 25
  },
  "mission_id": "msn_eval_07_001",
  "object_id": "wo_T_EVAL_07_r1",
  "objective": "实现 collect_pages：从 None 游标开始，按序聚合 items，在 next_cursor=None 结束，并拒绝循环、畸形响应和页数越界。",
  "parent_task_id": null,
  "rationale": "补齐 medium 风险 integration 分层，扩展配对质量—Token 证据。",
  "required_deliverables": [
    "git_commit",
    "patch",
    "test_results"
  ],
  "revision": 1,
  "risk": {
    "level": "medium",
    "reasons": [
      "只有 None 表示终止；继续游标必须是非空字符串且每次唯一。"
    ],
    "required_review": "terra-then-sol"
  },
  "schema": "token-firewall/work-order@0.2",
  "stop_conditions": [
    "需要修改公开测试或其他源文件",
    "需要增加第三方依赖",
    "Diff 超过 180 行"
  ],
  "task_id": "T-EVAL-07"
}
